<?xml version="1.0" encoding="ISO-8859-1"?>
<!--
 [y] hybris Platform

 Copyright (c) 2000-2016 SAP SE or an SAP affiliate company.
 All rights reserved.

 This software is the confidential and proprietary information of SAP
 ("Confidential Information"). You shall not disclose such Confidential
 Information and shall use it only in accordance with the terms of the
 license agreement you entered into with SAP.
-->


<!--
	ATTENTION: This is just an example file. You have to edit it according to your needs.
-->

<beans xmlns:xsi="http://www.w3.org/2001/XMLSchema-instance" xsi:noNamespaceSchemaLocation="beans.xsd">
	<bean class="de.hybris.platform.commercewebservicescommons.dto.order.PaymentDetailsWsDTO">
		<property name="encryptedCardNumber" type="String" />
		<property name="encryptedExpiryMonth" type="String" />
		<property name="encryptedExpiryYear" type="String" />
		<property name="encryptedSecurityCode" type="String" />
		<property name="saveCardData" type="Boolean" />
		<property name="adyenPaymentMethod" type="String" />
		<property name="adyenSelectedReference" type="String" />
		<property name="adyenSocialSecurityNumber" type="String" />
		<property name="adyenFirstName" type="String" />
		<property name="adyenLastName" type="String" />
	</bean>

	<bean class="de.hybris.platform.commercewebservicescommons.dto.order.AbstractOrderWsDTO">
		<property name="adyenBoletoUrl" type="String" />
		<property name="adyenBoletoData" type="String" />
		<property name="adyenBoletoExpirationDate" type="java.util.Date" />
		<property name="adyenBoletoDueDate" type="java.util.Date" />
	</bean>
</beans>
